{
  "artifact_kind": "fields",
  "artifact_path": "corpus/dev/dev_status_fallback/status-fallback-02/original.output.fields.json",
  "artifact_sha256": "f95ee2498168d8e8aac1786d5ce9b3f09fe5d48ae9c9f9a7d87e67d580057d26",
  "author_callsign": "0003_Codex_GPT-6_M10-DL2",
  "author_harness": "Codex",
  "author_session_id": "01a17ef6-6282-7162-9d28-0d5deb0d6496",
  "brief_sha256": "42383cf484a9d97f5ea5e117f6e68addc7a19aadbbe9639180421b70b21a7d25",
  "created_at": "2026-10-28T00:44:08Z",
  "evidence_paths": [],
  "family_id": "dev_status_fallback",
  "generator_sha256": null,
  "license_approval_id": null,
  "license_id": null,
  "license_status": "pending",
  "manifest_version": 1,
  "originality_attestation": "Original synthetic source/declarations authored by builder 0003/0912, Codex GPT-6 family, this exact session; generic static file writer only; no external/client/Gauntlet/partner/NIST ingestion, human authorship, independent custody or observed behavior claimed.",
  "parent_artifact_sha256": "564ac8e7b28234891db68640a18f635e98914336fe886e9b922f7517b474bfd3",
  "source_sha256": "564ac8e7b28234891db68640a18f635e98914336fe886e9b922f7517b474bfd3",
  "split": "dev"
}
