{
  "artifact_kind": "fields",
  "artifact_path": "corpus/dev/dev_decimal_tier/fee-tier-01/change.output.fields.json",
  "artifact_sha256": "f030d6eeb0eaca580eb86a0de81643be4bda5801a9d630c6b22af07a81f647e0",
  "author_callsign": "0003_Codex_GPT-6_M10-DL2",
  "author_harness": "Codex",
  "author_session_id": "01a17ef6-6282-7162-9d28-0d5deb0d6496",
  "brief_sha256": "42383cf484a9d97f5ea5e117f6e68addc7a19aadbbe9639180421b70b21a7d25",
  "created_at": "2026-10-28T00:44:08Z",
  "evidence_paths": [],
  "family_id": "dev_decimal_tier",
  "generator_sha256": null,
  "license_approval_id": null,
  "license_id": null,
  "license_status": "pending",
  "manifest_version": 1,
  "originality_attestation": "Original synthetic source/declarations authored by builder 0003/0912, Codex GPT-6 family, this exact session; generic static file writer only; no external/client/Gauntlet/partner/NIST ingestion, human authorship, independent custody or observed behavior claimed.",
  "parent_artifact_sha256": "84365b8bc1f7bda4e6cad9ad29c54d1094d2f87346a666ed78fdcadce6296e6e",
  "source_sha256": "84365b8bc1f7bda4e6cad9ad29c54d1094d2f87346a666ed78fdcadce6296e6e",
  "split": "dev"
}
