{
  "artifact_kind": "recipe",
  "artifact_path": "corpus/dev/dev_decimal_chain/fee-chain-04/original.task-binding.json",
  "artifact_sha256": "88252ed8f741c499cc73fa47b1166bdf051b5165e5443a05fbecd3e4b1e3f5eb",
  "author_callsign": "0003_Codex_GPT-6_M10-DL2",
  "author_harness": "Codex",
  "author_session_id": "01a17ef6-6282-7162-9d28-0d5deb0d6496",
  "brief_sha256": "1e53aface2f8320767814b7eeaed56f44416bec0342b3a4788f5d5016097c7c4",
  "created_at": "2026-10-28T01:08:55Z",
  "evidence_paths": [],
  "family_id": "dev_decimal_chain",
  "generator_sha256": null,
  "license_approval_id": null,
  "license_id": null,
  "license_status": "pending",
  "manifest_version": 1,
  "originality_attestation": "Original builder-authored declarative DEV recipe/task source, Codex GPT-6 family, actual session; generic static authoring only, no encoded/generated cases, external ingestion, observed answers or independent authority.",
  "parent_artifact_sha256": null,
  "source_sha256": "8e5203b377690dbfc276b95f714e551e65f0fc7621d48bdf997bcdcf81b31a52",
  "split": "dev"
}
