{
  "artifact_kind": "recipe",
  "artifact_path": "corpus/dev/dev_decimal_tier/fee-tier-01/original.paired-recipes.json",
  "artifact_sha256": "459d4d058ea6248a59c3d3669f2e574e97fecae95b1be8b240f74a41d287a402",
  "author_callsign": "0003_Codex_GPT-6_M10-DL2",
  "author_harness": "Codex",
  "author_session_id": "01a17ef6-6282-7162-9d28-0d5deb0d6496",
  "brief_sha256": "1e53aface2f8320767814b7eeaed56f44416bec0342b3a4788f5d5016097c7c4",
  "created_at": "2026-10-28T01:08:55Z",
  "evidence_paths": [],
  "family_id": "dev_decimal_tier",
  "generator_sha256": null,
  "license_approval_id": null,
  "license_id": null,
  "license_status": "pending",
  "manifest_version": 1,
  "originality_attestation": "Original builder-authored declarative DEV recipe/task source, Codex GPT-6 family, actual session; generic static authoring only, no encoded/generated cases, external ingestion, observed answers or independent authority.",
  "parent_artifact_sha256": null,
  "source_sha256": "4214569784fad2dd9723a3fb8d0d58df67bfa0707e5910b550ee92cee911371f",
  "split": "dev"
}
