{
  "artifact_kind": "changed_source",
  "artifact_path": "corpus/dev/dev_status_two_read/status-two-read-03/changed.cbl",
  "artifact_sha256": "5cf93258b79954af2333bc876c4ed7ee75276ff4f0044388f7bbd0a228989c88",
  "author_callsign": "0003_Codex_GPT-6_M10-DL2",
  "author_harness": "Codex",
  "author_session_id": "01a17ef6-6282-7162-9d28-0d5deb0d6496",
  "brief_sha256": "42383cf484a9d97f5ea5e117f6e68addc7a19aadbbe9639180421b70b21a7d25",
  "created_at": "2026-10-28T00:44:08Z",
  "evidence_paths": [],
  "family_id": "dev_status_two_read",
  "generator_sha256": null,
  "license_approval_id": null,
  "license_id": null,
  "license_status": "pending",
  "manifest_version": 1,
  "originality_attestation": "Original synthetic source/declarations authored by builder 0003/0912, Codex GPT-6 family, this exact session; generic static file writer only; no external/client/Gauntlet/partner/NIST ingestion, human authorship, independent custody or observed behavior claimed.",
  "parent_artifact_sha256": "2923e7a25ba404209bc80b719271271a7d4c37dac802cb74f14c6664f80e2e8d",
  "source_sha256": "5cf93258b79954af2333bc876c4ed7ee75276ff4f0044388f7bbd0a228989c88",
  "split": "dev"
}
