{
  "artifact_kind": "changed_source",
  "artifact_path": "corpus/dev/dev_year_century/year-century-03/changed.cbl",
  "artifact_sha256": "471eed53e2ee7b3c593a16dbb6a4a6ff664781c06c9a5ed46dde5d9a43158f4f",
  "author_callsign": "0003_Codex_GPT-6_M10-DL2",
  "author_harness": "Codex",
  "author_session_id": "01a17ef6-6282-7162-9d28-0d5deb0d6496",
  "brief_sha256": "42383cf484a9d97f5ea5e117f6e68addc7a19aadbbe9639180421b70b21a7d25",
  "created_at": "2026-10-28T00:44:08Z",
  "evidence_paths": [],
  "family_id": "dev_year_century",
  "generator_sha256": null,
  "license_approval_id": null,
  "license_id": null,
  "license_status": "pending",
  "manifest_version": 1,
  "originality_attestation": "Original synthetic source/declarations authored by builder 0003/0912, Codex GPT-6 family, this exact session; generic static file writer only; no external/client/Gauntlet/partner/NIST ingestion, human authorship, independent custody or observed behavior claimed.",
  "parent_artifact_sha256": "781ea65b5290f3de52c42a62f015ca50d9f5effb83b1ee210d1cc2b2425fe9ae",
  "source_sha256": "471eed53e2ee7b3c593a16dbb6a4a6ff664781c06c9a5ed46dde5d9a43158f4f",
  "split": "dev"
}
