{
  "artifact_kind": "specification",
  "artifact_path": "corpus/dev/dev_decimal_tier/fee-tier-02/change.program-manifest.pending.json",
  "artifact_sha256": "78cac64b9916d7546aef03a4c5f46e13e26e0b951e609dabf4e680dc4d3cd14b",
  "author_callsign": "0003_Codex_GPT-6_M10-DL2",
  "author_harness": "Codex",
  "author_session_id": "01a17ef6-6282-7162-9d28-0d5deb0d6496",
  "brief_sha256": "1e53aface2f8320767814b7eeaed56f44416bec0342b3a4788f5d5016097c7c4",
  "created_at": "2026-10-28T01:15:42Z",
  "evidence_paths": [],
  "family_id": "dev_decimal_tier",
  "generator_sha256": null,
  "license_approval_id": null,
  "license_id": null,
  "license_status": "pending",
  "manifest_version": 1,
  "originality_attestation": "R4 metadata revision authored by original builder0003/0912, Codex GPT-6 family, actual session01a17ef6-6282-7162-9d28-0d5deb0d6496. Revises prior metadata artifact SHA256 315a427166c442d1a913d49e9ed3a3a4eeca7efdd46df5d0b1b89cb0097d8a8b with prior sidecar SHA256 ece3a102d62303e28a1152cd0fa93f6f1b2d9e759f5b99eb99d818e27f2f8b1d at baselinefce9761; existing source_sha256 and valid source-parent relationship retained. Adds authored native boundary intent/recipe inventory only, no observed reachability, generated cases, independent authority, external ingestion or license approval.",
  "parent_artifact_sha256": "90c4c1af65da374b36826908e1ef1e02f821b2d467a8749b9f6bb039eab427eb",
  "source_sha256": "90c4c1af65da374b36826908e1ef1e02f821b2d467a8749b9f6bb039eab427eb",
  "split": "dev"
}
