{
  "artifact_kind": "fields",
  "artifact_path": "corpus/dev/dev_year_pivot_score/year-pivot-score-01/change.input.fields.json",
  "artifact_sha256": "685e9039a45afd1b39a0c509826174effd952f7ca50cc5a0f4fd5371498b6278",
  "author_callsign": "0003_Codex_GPT-6_M10-DL2",
  "author_harness": "Codex",
  "author_session_id": "01a17ef6-6282-7162-9d28-0d5deb0d6496",
  "brief_sha256": "42383cf484a9d97f5ea5e117f6e68addc7a19aadbbe9639180421b70b21a7d25",
  "created_at": "2026-10-28T00:44:08Z",
  "evidence_paths": [],
  "family_id": "dev_year_pivot_score",
  "generator_sha256": null,
  "license_approval_id": null,
  "license_id": null,
  "license_status": "pending",
  "manifest_version": 1,
  "originality_attestation": "Original synthetic source/declarations authored by builder 0003/0912, Codex GPT-6 family, this exact session; generic static file writer only; no external/client/Gauntlet/partner/NIST ingestion, human authorship, independent custody or observed behavior claimed.",
  "parent_artifact_sha256": "513a752e46c4f9a43fbd57c8ecc122e7dc48b0aaefd0a1957f120fce542a5373",
  "source_sha256": "513a752e46c4f9a43fbd57c8ecc122e7dc48b0aaefd0a1957f120fce542a5373",
  "split": "dev"
}
