{
  "artifact_kind": "recipe",
  "artifact_path": "corpus/dev/dev_year_century/year-century-02/change.task-binding.json",
  "artifact_sha256": "e91e1542f38add0b7821d6c908a9e5a247bceea16ce959bc43f4f380bb6ad1ec",
  "author_callsign": "0003_Codex_GPT-6_M10-DL2",
  "author_harness": "Codex",
  "author_session_id": "01a17ef6-6282-7162-9d28-0d5deb0d6496",
  "brief_sha256": "1e53aface2f8320767814b7eeaed56f44416bec0342b3a4788f5d5016097c7c4",
  "created_at": "2026-10-28T01:08:55Z",
  "evidence_paths": [],
  "family_id": "dev_year_century",
  "generator_sha256": null,
  "license_approval_id": null,
  "license_id": null,
  "license_status": "pending",
  "manifest_version": 1,
  "originality_attestation": "Original builder-authored declarative DEV recipe/task source, Codex GPT-6 family, actual session; generic static authoring only, no encoded/generated cases, external ingestion, observed answers or independent authority.",
  "parent_artifact_sha256": null,
  "source_sha256": "adf92f0e95e59a7242d3db649f7c5f65cf3528ebd96951bdb6f203c47a6e4fe1",
  "split": "dev"
}
