{
  "artifact_kind": "changed_source",
  "artifact_path": "corpus/dev/dev_status_fallback/status-fallback-04/changed.cbl",
  "artifact_sha256": "d0d3c2644785efd8ef1118b29b76b84d9bc8efabeeadd9d2b852146723e1858b",
  "author_callsign": "0003_Codex_GPT-6_M10-DL2",
  "author_harness": "Codex",
  "author_session_id": "01a17ef6-6282-7162-9d28-0d5deb0d6496",
  "brief_sha256": "42383cf484a9d97f5ea5e117f6e68addc7a19aadbbe9639180421b70b21a7d25",
  "created_at": "2026-10-28T00:44:08Z",
  "evidence_paths": [],
  "family_id": "dev_status_fallback",
  "generator_sha256": null,
  "license_approval_id": null,
  "license_id": null,
  "license_status": "pending",
  "manifest_version": 1,
  "originality_attestation": "Original synthetic source/declarations authored by builder 0003/0912, Codex GPT-6 family, this exact session; generic static file writer only; no external/client/Gauntlet/partner/NIST ingestion, human authorship, independent custody or observed behavior claimed.",
  "parent_artifact_sha256": "4c23d24d22e8fbd3fd09fc4df4ad1f687dfe9fb8e5c20f3237e0f1ea738f9304",
  "source_sha256": "d0d3c2644785efd8ef1118b29b76b84d9bc8efabeeadd9d2b852146723e1858b",
  "split": "dev"
}
