{
  "artifact_kind": "specification",
  "artifact_path": "corpus/dev/dev_decimal_tier/fee-tier-03/change.program-manifest.pending.json",
  "artifact_sha256": "e374395e308b3cb75968a308f35a6c44d3766b73537d364e18f2b985c4b53a16",
  "author_callsign": "0003_Codex_GPT-6_M10-DL2",
  "author_harness": "Codex",
  "author_session_id": "01a17ef6-6282-7162-9d28-0d5deb0d6496",
  "brief_sha256": "42383cf484a9d97f5ea5e117f6e68addc7a19aadbbe9639180421b70b21a7d25",
  "created_at": "2026-10-28T00:44:08Z",
  "evidence_paths": [],
  "family_id": "dev_decimal_tier",
  "generator_sha256": null,
  "license_approval_id": null,
  "license_id": null,
  "license_status": "pending",
  "manifest_version": 1,
  "originality_attestation": "Original synthetic source/declarations authored by builder 0003/0912, Codex GPT-6 family, this exact session; generic static file writer only; no external/client/Gauntlet/partner/NIST ingestion, human authorship, independent custody or observed behavior claimed.",
  "parent_artifact_sha256": "5e0147b45a3e0374ac9b54def58e3637923634610dcd316da18b2bd1dee54afc",
  "source_sha256": "5e0147b45a3e0374ac9b54def58e3637923634610dcd316da18b2bd1dee54afc",
  "split": "dev"
}
