{
  "artifact_kind": "specification",
  "artifact_path": "corpus/dev/dev_status_fallback/status-fallback-02/change.program-manifest.pending.json",
  "artifact_sha256": "7868a8b637b1c940e9b16a4e25ef52f004c5bdd4f319b12610a470948d593c6c",
  "author_callsign": "0003_Codex_GPT-6_M10-DL2",
  "author_harness": "Codex",
  "author_session_id": "01a17ef6-6282-7162-9d28-0d5deb0d6496",
  "brief_sha256": "1e53aface2f8320767814b7eeaed56f44416bec0342b3a4788f5d5016097c7c4",
  "created_at": "2026-10-28T01:15:42Z",
  "evidence_paths": [],
  "family_id": "dev_status_fallback",
  "generator_sha256": null,
  "license_approval_id": null,
  "license_id": null,
  "license_status": "pending",
  "manifest_version": 1,
  "originality_attestation": "R4 metadata revision authored by original builder0003/0912, Codex GPT-6 family, actual session01a17ef6-6282-7162-9d28-0d5deb0d6496. Revises prior metadata artifact SHA256 3311baa59a96832c3d910a314d5b824bb66f0e0d63fa75f61a6ce30a0e3af308 with prior sidecar SHA256 78c3a1b0c1c7f2f3db9da490218d9f4a65a7236948458ff6955df5f0bba4cbfd at baselinefce9761; existing source_sha256 and valid source-parent relationship retained. Adds authored native boundary intent/recipe inventory only, no observed reachability, generated cases, independent authority, external ingestion or license approval.",
  "parent_artifact_sha256": "453d8d58167148b5f62d91aff60279ce4b1c774ce3dba4628179df64f6517b8f",
  "source_sha256": "453d8d58167148b5f62d91aff60279ce4b1c774ce3dba4628179df64f6517b8f",
  "split": "dev"
}
