{
  "artifact_kind": "changed_source",
  "artifact_path": "corpus/dev/dev_year_pivot_score/year-pivot-score-02/changed.cbl",
  "artifact_sha256": "8474c0531cf27701ad610e03522815e70951043d23bf74744b211ecfc170ab4c",
  "author_callsign": "0003_Codex_GPT-6_M10-DL2",
  "author_harness": "Codex",
  "author_session_id": "01a17ef6-6282-7162-9d28-0d5deb0d6496",
  "brief_sha256": "42383cf484a9d97f5ea5e117f6e68addc7a19aadbbe9639180421b70b21a7d25",
  "created_at": "2026-10-28T00:44:08Z",
  "evidence_paths": [],
  "family_id": "dev_year_pivot_score",
  "generator_sha256": null,
  "license_approval_id": null,
  "license_id": null,
  "license_status": "pending",
  "manifest_version": 1,
  "originality_attestation": "Original synthetic source/declarations authored by builder 0003/0912, Codex GPT-6 family, this exact session; generic static file writer only; no external/client/Gauntlet/partner/NIST ingestion, human authorship, independent custody or observed behavior claimed.",
  "parent_artifact_sha256": "d9e48f0ffb5ca7267d1826fc43f2ed6877161d1551d02fd8868efc7e2351ebeb",
  "source_sha256": "8474c0531cf27701ad610e03522815e70951043d23bf74744b211ecfc170ab4c",
  "split": "dev"
}
