{
  "artifact_kind": "fields",
  "artifact_path": "corpus/dev/dev_decimal_chain/fee-chain-01/change.output.fields.json",
  "artifact_sha256": "2b40e0ec6a645c59969c893a7f9a8e24f9508c1510561c51c1359e2b4d58e129",
  "author_callsign": "0003_Codex_GPT-6_M10-DL2",
  "author_harness": "Codex",
  "author_session_id": "01a17ef6-6282-7162-9d28-0d5deb0d6496",
  "brief_sha256": "42383cf484a9d97f5ea5e117f6e68addc7a19aadbbe9639180421b70b21a7d25",
  "created_at": "2026-10-28T00:44:08Z",
  "evidence_paths": [],
  "family_id": "dev_decimal_chain",
  "generator_sha256": null,
  "license_approval_id": null,
  "license_id": null,
  "license_status": "pending",
  "manifest_version": 1,
  "originality_attestation": "Original synthetic source/declarations authored by builder 0003/0912, Codex GPT-6 family, this exact session; generic static file writer only; no external/client/Gauntlet/partner/NIST ingestion, human authorship, independent custody or observed behavior claimed.",
  "parent_artifact_sha256": "b342167535ec14f708602936d3092c0d3e52ad3cc517e5e18ebac6455d28b597",
  "source_sha256": "b342167535ec14f708602936d3092c0d3e52ad3cc517e5e18ebac6455d28b597",
  "split": "dev"
}
