{
  "artifact_kind": "specification",
  "artifact_path": "corpus/dev/dev_decimal_tier/fee-tier-03/original.program-manifest.pending.json",
  "artifact_sha256": "da04be32694b527850acc9a796f8ebb27d9723fcfa765104b24060b1f620d22a",
  "author_callsign": "0003_Codex_GPT-6_M10-DL2",
  "author_harness": "Codex",
  "author_session_id": "01a17ef6-6282-7162-9d28-0d5deb0d6496",
  "brief_sha256": "1e53aface2f8320767814b7eeaed56f44416bec0342b3a4788f5d5016097c7c4",
  "created_at": "2026-10-28T01:15:42Z",
  "evidence_paths": [],
  "family_id": "dev_decimal_tier",
  "generator_sha256": null,
  "license_approval_id": null,
  "license_id": null,
  "license_status": "pending",
  "manifest_version": 1,
  "originality_attestation": "R4 metadata revision authored by original builder0003/0912, Codex GPT-6 family, actual session01a17ef6-6282-7162-9d28-0d5deb0d6496. Revises prior metadata artifact SHA256 6cede558e5950ab7ee1bcb82993a91703e72e6a0bfcea8ed9f6e52de71261e85 with prior sidecar SHA256 4fe4913f16d54a41f0acd809698e8941975683cf318d63beb9e6a6d92dacf8de at baselinefce9761; existing source_sha256 and valid source-parent relationship retained. Adds authored native boundary intent/recipe inventory only, no observed reachability, generated cases, independent authority, external ingestion or license approval.",
  "parent_artifact_sha256": "93ba427a296e6875e581c86bfbc26ec7437f51eab8cbbdedc450c238858564f3",
  "source_sha256": "93ba427a296e6875e581c86bfbc26ec7437f51eab8cbbdedc450c238858564f3",
  "split": "dev"
}
